价格,面积,编号,户型,楼层,位置1,位置2,小区,地铁,每平米价格
1610.0,9.0,41915-D,4室1卫,3/13层,房山区,广阳城,世茂维拉,地铁：距房山线广阳城站700米,178.88888888888889
2480.0,14.0,43885-C,3室1卫,6/6层,朝阳区,草房,连心园东区,地铁：距6号线草房站500米,177.14285714285714
1690.0,14.0,48391-D,4室2卫,2/6层,昌平区,昌平,西环里,地铁：距昌平线昌平站1200米,120.71428571428571
2180.0,17.0,51213-A,3室1卫,3/6层,通州区,物资学院路,永顺西里,地铁：距6号线物资学院路站1150米,128.23529411764707
3820.0,16.0,51421-A,4室1卫,6/22层,丰台区,泥洼,盛鑫嘉园,地铁：距10号线泥洼站50米,238.75
2440.0,13.0,4990-C,3室1卫,5/6层,朝阳区,黄渠,常营民族家园J区,地铁：距6号线黄渠站900米,187.69230769230768
2390.0,12.0,55918-B,3室1卫,1/13层,石景山区,八角游乐园,世纪佳苑,地铁：距1号线八角游乐园站1000米,199.16666666666666
1560.0,11.0,59622-C,4室2卫,7/19层,房山区,良乡大学城,远洋新仕界,地铁：距房山线良乡大学城站400米,141.8181818181818
3140.0,17.0,593-B,3室1卫,5/15层,朝阳区,青年路,阿曼寓所,地铁：距6号线青年路站1000米,184.7058823529412
2750.0,16.0,66593-C,3室1卫,3/6层,朝阳区,黄渠,常营民族家园N区,地铁：距6号线黄渠站400米,171.875
1600.0,13.0,67816-B,4室1卫,1/6层,顺义区,石门,澜西园,地铁：距15号线石门站2200米,123.07692307692308
2820.0,13.0,69693-C,3室1卫,1/6层,昌平区,龙泽,龙兴园中区,"地铁：距13号线,昌平线西二旗站1600米",216.92307692307693
3450.0,13.0,79897-A,4室1卫,9/30层,朝阳区,大望路,soho现代城,"地铁：距1号线,14号线东段大望路站250米",265.38461538461536
2470.0,11.0,8942-A,4室1卫,1/10层,朝阳区,传媒大学,艺水芳园,地铁：距八通线传媒大学站950米,224.54545454545453
3260.0,26.0,8942-B,4室1卫,1/10层,朝阳区,传媒大学,艺水芳园,地铁：距八通线传媒大学站950米,125.38461538461539
1620.0,11.0,81047-C,3室1卫,5/15层,房山区,长阳,军留庄,地铁：距房山线长阳站700米,147.27272727272728
2760.0,8.0,119689-A,3室1卫,20/24层,丰台区,角门西,嘉丽园,"地铁：距10号线,4号线大兴线角门西站150米",345.0
1640.0,14.0,122645-D,4室1卫,3/6层,昌平区,昌平,东关北里小区,地铁：距昌平线昌平站1000米,117.14285714285714
2570.0,13.0,128579-B,5室1卫,3/13层,丰台区,樊羊路,益辰欣园,地铁：距房山线樊羊路站450米,197.69230769230768
3880.0,17.0,12801-A,3室1卫,5/25层,朝阳区,阜通,花家地西里,地铁：距14号线东段阜通站900米,228.23529411764707
10750.0,120.0,147270-A,2室1卫,10/22层,东城区,广渠门外,双花园南里,"地铁：距7号线,17号线广渠门外站650米",89.58333333333333
1500.0,9.0,14250-C,4室1卫,2/18层,通州区,通运门,京贸家园,地铁：距6号线通运门站2650米,166.66666666666666
5140.0,50.0,19447-A,1室1卫,6/6层,丰台区,石榴庄,石榴园北里,地铁：距10号线石榴庄站250米,102.8
4870.0,26.0,20797-E,5室1卫,11/27层,朝阳区,三元桥,国际港,"地铁：距10号线,12号线,机场线三元桥站300米",187.30769230769232
2190.0,8.0,2249-C,3室1卫,8/15层,丰台区,新宫,德鑫嘉园三期,"地铁：距4号线大兴线,19号线新宫站850米",273.75
2000.0,11.0,22342-B,3室1卫,8/11层,顺义区,国展,翠竹新村,地铁：距15号线国展站1800米,181.8181818181818
6030.0,57.0,24999-A,1室1卫,14/26层,西城区,达官营,远见名苑,"地铁：距7号线,16号线达官营站400米",105.78947368421052
1800.0,12.0,25190-C,4室2卫,6/6层,顺义区,石门,前进花园石门苑,地铁：距15号线石门站800米,150.0
1590.0,8.0,27830-C,4室1卫,20/21层,丰台区,张郭庄,红山郡,地铁：距14号线西段张郭庄站1750米,198.75
2380.0,9.0,32734-C,4室1卫,12/19层,朝阳区,双桥,水郡长安,地铁：距八通线双桥站800米,264.44444444444446
1290.0,9.0,41436-C,3室1卫,3/10层,房山区,良乡大学城,东羊庄新村,地铁：距房山线良乡大学城站1200米,143.33333333333334
4840.0,28.0,42870-A,1室1卫,18/23层,丰台区,马家堡,玺萌丽苑,地铁：距4号线大兴线马家堡站650米,172.85714285714286
2180.0,10.0,43793-B,2室1卫,5/6层,石景山区,金安桥,九中教工宿舍楼,"地铁：距1号线,6号线苹果园站1600米",218.0
2790.0,15.0,45442-C,3室1卫,4/18层,丰台区,石榴庄,石榴园南里,地铁：距10号线石榴庄站400米,186.0
2550.0,10.0,4616-A,3室1卫,1/6层,昌平区,龙泽,龙华园,地铁：距13号线龙泽站800米,255.0
2470.0,10.0,45778-D,4室1卫,10/16层,大兴区,万源街,鹿鸣苑,地铁：距亦庄线万源街站550米,247.0
1550.0,14.0,51504-D,4室1卫,3/6层,房山区,良乡大学城西,鸿顺园东区,地铁：距房山线良乡大学城西站350米,110.71428571428571
2190.0,10.0,57112-A,3室1卫,14/15层,丰台区,大葆台,欣葆家园二区,地铁：距房山线大葆台站650米,219.0
2930.0,6.0,61880-A,2室1卫,10/15层,西城区,西直门,交大东路56号院,"地铁：距2号线,4号线大兴线,13号线西直门站900米",488.3333333333333
2570.0,11.0,6754-B,4室1卫,6/24层,朝阳区,北工大西门,南新园,地铁：距14号线东段北工大西门站600米,233.63636363636363
2240.0,9.0,70666-B,3室1卫,5/6层,昌平区,生命科学园,领秀慧谷A区,地铁：距昌平线生命科学园站850米,248.88888888888889
2500.0,15.0,75060-C,5室1卫,2/11层,丰台区,石榴庄,彩虹城三区,地铁：距10号线石榴庄站950米,166.66666666666666
2260.0,8.0,8928-A,4室1卫,17/22层,丰台区,方庄,四方景园一区,地铁：距14号线东段方庄站850米,282.5
3020.0,18.0,8928-B,4室1卫,17/22层,丰台区,方庄,四方景园一区,地铁：距14号线东段方庄站850米,167.77777777777777
3210.0,16.0,8872-B,3室1卫,1/15层,朝阳区,关庄,嘉铭桐城-A区,地铁：距15号线关庄站150米,200.625
2380.0,10.0,8977-B,3室1卫,26/28层,通州区,物资学院路,新建村小区,地铁：距6号线物资学院路站550米,238.0
2890.0,14.0,8977-C,3室1卫,26/28层,通州区,物资学院路,新建村小区,地铁：距6号线物资学院路站550米,206.42857142857142
1920.0,17.0,121707-C,3室1卫,5/6层,通州区,北运河西,玉桥中路2号院,地铁：距6号线北运河西站950米,112.94117647058823
1800.0,13.0,123301-B,3室1卫,1/5层,通州区,同济南路,神龙金桥,地铁：距亦庄线同济南路站2650米,138.46153846153845
4890.0,52.0,124339-A,1室1卫,1/21层,朝阳区,传媒大学,北花园小区,地铁：距八通线传媒大学站600米,94.03846153846153
1320.0,11.0,124415-A,3室1卫,3/10层,房山区,良乡大学城,东羊庄新村,地铁：距房山线良乡大学城站1200米,120.0
1710.0,13.0,141784-A,4室1卫,5/6层,昌平区,昌平东关,昌盛园一区,地铁：距昌平线昌平东关站1200米,131.53846153846155
1590.0,10.0,142349-B,3室1卫,1/12层,房山区,篱笆房,清雅小区,地铁：距房山线篱笆房站850米,159.0
2820.0,10.0,143730-B,2室1卫,4/6层,通州区,通州北苑,新华联锦园,地铁：距八通线通州北苑站650米,282.0
3860.0,47.0,144084-A,1室1卫,1/13层,通州区,北运河东,荔景园,地铁：距6号线北运河东站1100米,82.12765957446808
2590.0,10.0,138113-B,3室1卫,1/18层,朝阳区,北苑路北,北苑佳兴园,地铁：距5号线北苑路北站600米,259.0
3620.0,17.0,143409-D,4室2卫,14/24层,朝阳区,安立路,慧忠北里,地铁：距15号线安立路站250米,212.94117647058823
2130.0,14.0,146602-C,3室2卫,4/12层,昌平区,昌平东关,随园,地铁：距昌平线昌平东关站1000米,152.14285714285714
2820.0,15.0,16203-B,3室1卫,4/6层,丰台区,石榴庄,康泽园,地铁：距10号线石榴庄站600米,188.0
1720.0,11.0,22268-A,2室1卫,4/6层,通州区,梨园,艺苑东街,地铁：距八通线梨园站1350米,156.36363636363637
1830.0,7.0,25925-B,3室1卫,9/16层,顺义区,花梨坎,枫泉花园,地铁：距15号线花梨坎站700米,261.42857142857144
1690.0,10.0,28803-B,4室1卫,19/23层,通州区,通州北关,富力惠兰美居,地铁：距6号线通州北关站3100米,169.0
3300.0,10.0,34977-B,3室1卫,14/18层,丰台区,马家堡,丰开苑,地铁：距4号线大兴线马家堡站400米,330.0
3550.0,9.0,40160-C,3室1卫,4/29层,朝阳区,来广营,北纬40度一期,地铁：距14号线东段来广营站250米,394.44444444444446
2100.0,24.0,391-A,7室2卫,6/6层,昌平区,天通苑东,天通苑东二区,地铁：距17号线天通苑东站650米,87.5
1750.0,10.0,45426-B,3室1卫,3/5层,大兴区,五福堂,德茂小区,地铁：距8号线南段五福堂站1050米,175.0
1720.0,10.0,45426-C,3室1卫,3/5层,大兴区,五福堂,德茂小区,地铁：距8号线南段五福堂站1050米,172.0
1690.0,11.0,48704-B,4室1卫,1/6层,通州区,梨园,梨园北小区,地铁：距八通线梨园站500米,153.63636363636363
1670.0,12.0,48941-D,4室1卫,5/6层,通州区,梨园,云景西里,地铁：距八通线梨园站750米,139.16666666666666
2540.0,11.0,51408-C,3室1卫,4/6层,东城区,景泰,定安里,地铁：距14号线东段景泰站450米,230.9090909090909
2360.0,12.0,55839-C,3室1卫,13/25层,石景山区,杨庄,地铁古城家园,"地铁：距1号线,6号线苹果园站1300米",196.66666666666666
2280.0,11.0,58636-B,3室1卫,1/6层,通州区,物资学院路,邓家窑,地铁：距6号线物资学院路站250米,207.27272727272728
1960.0,13.0,66360-B,4室1卫,5/6层,通州区,果园,新华联家园南区,地铁：距八通线果园站650米,150.76923076923077
2100.0,14.0,67630-A,4室1卫,4/6层,丰台区,火箭万源,云龙家园,地铁：距亦庄线旧宫站2250米,150.0
1670.0,9.0,67811-A,6室2卫,19/27层,大兴区,天宫院,保利春天里一区,地铁：距4号线大兴线天宫院站250米,185.55555555555554
2250.0,12.0,61257-A,3室1卫,6/18层,通州区,通州北苑,通惠苑,地铁：距八通线通州北苑站650米,187.5
1930.0,20.0,79852-B,2室1卫,1/15层,通州区,土桥,金隅七零九零,地铁：距八通线土桥站1750米,96.5
2790.0,17.0,8928-C,4室1卫,17/22层,丰台区,方庄,四方景园一区,地铁：距14号线东段方庄站850米,164.11764705882354
1650.0,10.0,118331-B,4室1卫,2/6层,丰台区,张郭庄,福生园,地铁：距14号线西段张郭庄站700米,165.0
4200.0,13.0,127220-A,2室1卫,11/23层,海淀区,五棵松,今日家园,地铁：距1号线五棵松站900米,323.0769230769231
3850.0,9.0,127220-B,2室1卫,11/23层,海淀区,五棵松,今日家园,地铁：距1号线五棵松站900米,427.77777777777777
1800.0,14.0,127846-C,3室1卫,5/6层,大兴区,黄村火车站,观音寺南里,地铁：距4号线大兴线黄村火车站站1500米,128.57142857142858
1900.0,10.0,133781-D,4室1卫,3/6层,通州区,次渠,次渠怡芳园小区,"地铁：距亦庄线,17号线次渠站600米",190.0
2710.0,12.0,133510-C,4室1卫,2/3层,丰台区,方庄,芳城园二区,地铁：距14号线东段方庄站650米,225.83333333333334
2010.0,14.0,141519-A,4室1卫,6/16层,丰台区,东高地,蓝天怡景,地铁：距8号线南段东高地站1450米,143.57142857142858
1790.0,14.0,12624-E,5室2卫,4/6层,通州区,通州北关,永顺南里2号院,地铁：距6号线通州北关站1300米,127.85714285714286
1500.0,10.0,140805-C,3室1卫,4/6层,通州区,通州北关,东潞苑,地铁：距6号线通州北关站2350米,150.0
1750.0,12.0,19029-D,4室1卫,11/22层,通州区,通州北关,富力惠兰美居,地铁：距6号线通州北关站3100米,145.83333333333334
2460.0,16.0,18964-C,3室1卫,4/6层,朝阳区,黄渠,常营民族家园B区,地铁：距6号线黄渠站800米,153.75
2050.0,7.0,1935-B,4室1卫,8/17层,朝阳区,高碑店,金隅汇星苑,地铁：距6号线青年路站1450米,292.85714285714283
2980.0,10.0,19893-B,4室1卫,1/20层,朝阳区,望京,望京西园四区,"地铁：距14号线东段,15号线望京站400米",298.0
2340.0,19.0,22629-A,2室1卫,2/6层,通州区,临河里,群芳园,地铁：距八通线临河里站1200米,123.15789473684211
2370.0,10.0,21681-E,6室1卫,15/16层,昌平区,天通苑,天通苑北一区,地铁：距5号线天通苑站350米,237.0
2360.0,8.0,2141-C,3室1卫,11/25层,朝阳区,北工大西门,双龙南里,地铁：距14号线东段北工大西门站450米,295.0
1340.0,13.0,22311-E,5室2卫,6/6层,顺义区,顺义,双兴北区,地铁：距15号线顺义站1250米,103.07692307692308
2480.0,9.0,2630-C,4室1卫,14/24层,丰台区,石榴庄,慧时欣园,地铁：距10号线石榴庄站200米,275.55555555555554
2000.0,11.0,30994-A,3室1卫,3/13层,朝阳区,东坝中街,金泽家园C区,地铁：距6号线褡裢坡站3950米,181.8181818181818
1710.0,7.0,27052-D,4室1卫,4/21层,朝阳区,平房村,金隅景和园(朝新嘉园东里7区),地铁：距6号线褡裢坡站3150米,244.28571428571428
2070.0,6.0,34235-B,4室1卫,10/14层,丰台区,新宫,合顺家园,"地铁：距4号线大兴线,19号线新宫站700米",345.0
2560.0,14.0,33023-C,3室1卫,23/28层,通州区,物资学院路,新建村二期,地铁：距6号线物资学院路站550米,182.85714285714286
1730.0,11.0,28686-A,4室2卫,6/7层,通州区,九棵树,龙鼎园,地铁：距八通线九棵树站1550米,157.27272727272728
1600.0,11.0,35610-B,3室1卫,10/15层,房山区,篱笆房,加州水郡三期,地铁：距房山线篱笆房站2200米,145.45454545454547
1960.0,9.0,33442-B,4室1卫,17/18层,朝阳区,管庄,远洋一方润园,地铁：距八通线管庄站950米,217.77777777777777
1410.0,7.0,42701-A,4室1卫,5/12层,丰台区,张郭庄,红山郡,地铁：距14号线西段张郭庄站1750米,201.42857142857142
1730.0,10.0,45938-C,4室1卫,9/12层,顺义区,石门,前进花园石门苑,地铁：距15号线石门站800米,173.0
2370.0,14.0,48348-C,4室1卫,12/18层,大兴区,亦庄文化园,新康家园,地铁：距亦庄线亦庄文化园站750米,169.28571428571428
1830.0,9.0,51297-B,3室1卫,5/26层,通州区,梨园,新城嘉园（通州）,地铁：距八通线梨园站550米,203.33333333333334
2340.0,9.0,55284-C,3室1卫,9/11层,朝阳区,常营,保利嘉园3号院,地铁：距6号线常营站800米,260.0
2670.0,18.0,66399-B,2室1卫,3/6层,石景山区,古城,古城特钢楼,地铁：距1号线古城站1150米,148.33333333333334
1770.0,8.0,71590-D,4室1卫,15/15层,顺义区,花梨坎,天裕昕园,地铁：距15号线花梨坎站2550米,221.25
3670.0,16.0,69548-A,3室1卫,1/6层,朝阳区,将台,酒仙桥一街坊,地铁：距14号线东段将台站650米,229.375
2600.0,9.0,73556-A,2室1卫,1/12层,东城区,景泰,华龙美晟,地铁：距14号线东段景泰站500米,288.8888888888889
2840.0,12.0,680-D,4室2卫,6/12层,朝阳区,成寿寺,中海城风情苑,地铁：距10号线成寿寺站350米,236.66666666666666
2390.0,12.0,77035-C,3室1卫,3/6层,丰台区,首经贸,育菲园东里,"地铁：距10号线,房山线首经贸站300米",199.16666666666666
2560.0,13.0,79731-B,3室1卫,10/18层,丰台区,科怡路,城市经典,地铁：距9号线科怡路站350米,196.92307692307693
3290.0,24.0,8710-D,5室1卫,22/26层,朝阳区,欢乐谷景区,北京华侨城1号院,地铁：距7号线欢乐谷景区站350米,137.08333333333334
2210.0,10.0,9028-A,3室1卫,10/28层,通州区,物资学院路,新建村小区,地铁：距6号线物资学院路站550米,221.0
2920.0,15.0,119440-A,4室1卫,9/24层,丰台区,西局,丽泽雅园,"地铁：距10号线,14号线西段西局站1700米",194.66666666666666
2350.0,35.0,1027-G,7室2卫,6/6层,昌平区,天通苑东,天通苑东二区,地铁：距17号线天通苑东站650米,67.14285714285714
3860.0,13.0,122751-A,3室1卫,2/6层,海淀区,五道口,中国地质大学家属院,地铁：距13号线五道口站400米,296.9230769230769
2440.0,9.0,124175-A,3室1卫,4/6层,丰台区,蒲黄榆,蒲黄榆二里,"地铁：距5号线,14号线东段蒲黄榆站600米",271.1111111111111
2590.0,13.0,129141-B,3室1卫,2/11层,朝阳区,孙河,康营小区15区,地铁：距15号线孙河站1050米,199.23076923076923
2630.0,9.0,11478-A,3室1卫,2/22层,丰台区,方庄,芳城园一区,地铁：距14号线东段方庄站550米,292.22222222222223
1860.0,10.0,11498-C,3室1卫,4/6层,朝阳区,八里桥,瑞祥里小区,地铁：距八通线八里桥站750米,186.0
2600.0,20.0,140653-B,2室1卫,1/6层,丰台区,科怡路,保温段住宅小区,地铁：距9号线科怡路站1550米,130.0
1840.0,9.0,143951-D,4室1卫,4/6层,大兴区,高米店北,郁花园一里,地铁：距4号线大兴线高米店北站600米,204.44444444444446
1850.0,20.0,143193-C,4室1卫,9/25层,昌平区,昌平,新悦家园,地铁：距昌平线昌平站1200米,92.5
3620.0,21.0,146758-C,3室1卫,19/28层,朝阳区,大郊亭,金海国际,地铁：距7号线大郊亭站400米,172.38095238095238
2080.0,12.0,155034-B,2室1卫,4/6层,通州区,通州北苑,科印小区,地铁：距八通线通州北苑站450米,173.33333333333334
2830.0,13.0,14467-D,5室1卫,6/26层,朝阳区,十里河,嘉多丽园,"地铁：距10号线,14号线东段,17号线十里河站250米",217.69230769230768
2900.0,13.0,1571-B,3室1卫,3/6层,朝阳区,青年路,雅成一里,地铁：距6号线青年路站550米,223.07692307692307
2380.0,9.0,1620-C,3室1卫,15/21层,朝阳区,高碑店,金隅汇星苑,地铁：距6号线青年路站1450米,264.44444444444446
2450.0,10.0,1598-B,5室1卫,8/28层,朝阳区,青年路,甘露家园,地铁：距6号线青年路站700米,245.0
6400.0,58.0,17018-A,1室1卫,7/28层,海淀区,六道口,双清路2号院,地铁：距15号线六道口站1800米,110.34482758620689
1820.0,15.0,17185-B,3室1卫,2/6层,房山区,良乡大学城西,阳光邑上,地铁：距房山线良乡大学城西站750米,121.33333333333333
2860.0,10.0,17606-B,4室1卫,5/19层,海淀区,西二旗,回龙观新村西区,"地铁：距13号线,昌平线西二旗站1050米",286.0
2210.0,12.0,18983-C,4室1卫,1/6层,顺义区,国展,莲竹花园,地铁：距15号线国展站350米,184.16666666666666
2570.0,19.0,2239-B,3室1卫,1/6层,朝阳区,潘家园,潘家园小区,地铁：距10号线潘家园站1000米,135.26315789473685
2530.0,13.0,19805-D,4室1卫,27/28层,丰台区,樊羊路,花香东苑,地铁：距房山线樊羊路站450米,194.6153846153846
2310.0,14.0,23420-C,3室1卫,15/17层,通州区,次渠南,次渠南里,地铁：距亦庄线次渠南站700米,165.0
1410.0,12.0,24501-B,4室1卫,1/6层,房山区,良乡大学城西,鸿顺园东区,地铁：距房山线良乡大学城西站350米,117.5
3210.0,11.0,2436-B,3室1卫,5/26层,海淀区,西二旗,回龙观新村中区,"地铁：距13号线,昌平线西二旗站1100米",291.8181818181818
1540.0,8.0,25571-B,4室1卫,7/23层,通州区,通州北关,富力惠兰美居,地铁：距6号线通州北关站3100米,192.5
1420.0,8.0,25556-A,4室1卫,20/20层,门头沟区,小园,保利首开四季怡园,地铁：距S1线小园站950米,177.5
2030.0,15.0,27478-A,4室1卫,7/12层,顺义区,石门,石景苑,地铁：距15号线石门站850米,135.33333333333334
2030.0,9.0,32740-A,2室1卫,3/6层,大兴区,枣园,滨河东里,地铁：距4号线大兴线枣园站850米,225.55555555555554
1470.0,10.0,32549-A,3室1卫,6/6层,通州区,通州北关,潞苑嘉园,地铁：距6号线通州北关站2050米,147.0
2830.0,16.0,37940-B,3室1卫,6/18层,丰台区,大红门,鑫福里小区,"地铁：距8号线南段,10号线大红门站450米",176.875
2350.0,8.0,43031-B,4室1卫,4/5层,昌平区,回龙观,南店新村,地铁：距8号线育新站1100米,293.75
2650.0,14.0,4125-C,4室1卫,9/12层,朝阳区,常营,万象新天二区,地铁：距6号线常营站400米,189.28571428571428
2400.0,10.0,45856-C,3室1卫,5/28层,通州区,物资学院路,新建村二期,地铁：距6号线物资学院路站550米,240.0
2370.0,11.0,46160-A,3室1卫,10/11层,朝阳区,草房,保利嘉园1号院,地铁：距6号线草房站950米,215.45454545454547
2290.0,8.0,35-C,4室1卫,8/22层,朝阳区,常营,北辰福第中区,地铁：距6号线常营站450米,286.25
3610.0,56.0,48298-A,1室1卫,3/6层,房山区,广阳城,广阳城新区,地铁：距房山线广阳城站300米,64.46428571428571
3630.0,12.0,47973-C,3室1卫,2/5层,朝阳区,香河园,新源里西,地铁：距17号线香河园站500米,302.5
2530.0,8.0,50978-A,3室1卫,12/18层,朝阳区,劲松,农光东里,地铁：距10号线劲松站700米,316.25
1510.0,10.0,52767-C,3室1卫,10/19层,房山区,良乡大学城北,智汇雅苑,地铁：距房山线良乡大学城北站450米,151.0
1500.0,10.0,57617-A,4室1卫,3/6层,房山区,广阳城,碧波园,地铁：距房山线广阳城站500米,150.0
3120.0,12.0,58877-B,3室1卫,6/28层,朝阳区,潘家园,百环花园,地铁：距10号线潘家园站250米,260.0
2690.0,22.0,62941-B,4室1卫,1/5层,通州区,北运河西,BOBO自由城,地铁：距6号线北运河西站800米,122.27272727272727
1960.0,15.0,64543-C,3室1卫,1/21层,房山区,长阳,首开熙悦山澜庭,地铁：距房山线长阳站300米,130.66666666666666
2910.0,18.0,66150-C,3室1卫,5/6层,朝阳区,四惠,百子湾路2号楼,地铁：距7号线百子湾站1250米,161.66666666666666
2580.0,11.0,69360-B,3室1卫,27/28层,朝阳区,北岗子,将府锦苑,地铁：距14号线东段将台站3550米,234.54545454545453
2780.0,18.0,70093-A,2室1卫,2/5层,石景山区,古城,十万坪,地铁：距1号线古城站600米,154.44444444444446
1890.0,12.0,69776-C,3室1卫,5/6层,大兴区,黄村西大街,兴政东里,地铁：距4号线大兴线黄村西大街站1000米,157.5
1970.0,12.0,76524-B,3室1卫,15/17层,昌平区,南邵,何营路小区,地铁：,164.16666666666666
2550.0,14.0,8221-C,3室1卫,27/28层,通州区,物资学院路,新建村小区,地铁：距6号线物资学院路站550米,182.14285714285714
3620.0,8.0,80929-B,5室2卫,5/10层,朝阳区,朝阳门,吉庆里小区,"地铁：距2号线,6号线朝阳门站600米",452.5
1910.0,9.0,115101-D,4室1卫,5/7层,昌平区,天通苑东,天通苑东二区,地铁：距17号线天通苑东站650米,212.22222222222223
3610.0,19.0,10422-A,2室1卫,1/5层,朝阳区,金台夕照,呼家楼新街大院,地铁：距10号线金台夕照站600米,190.0
2760.0,8.0,131694-C,4室1卫,19/28层,海淀区,西二旗,回龙观新村西区,"地铁：距13号线,昌平线西二旗站1050米",345.0
6150.0,73.0,134721-A,2室1卫,2/18层,昌平区,回龙观东大街,紫金新干线四期,地铁：距8号线回龙观东大街站1400米,84.24657534246575
1720.0,9.0,142843-A,4室1卫,17/20层,顺义区,顺义,金汉绿港三区,地铁：距15号线顺义站650米,191.11111111111111
2470.0,12.0,143798-B,3室1卫,15/15层,丰台区,大葆台,欣葆家园二区,地铁：距房山线大葆台站650米,205.83333333333334
1850.0,13.0,134432-A,3室1卫,3/6层,通州区,北运河西,玉桥北里,地铁：距6号线北运河西站1250米,142.30769230769232
1780.0,16.0,145679-B,2室1卫,4/6层,昌平区,昌平,御路园,地铁：距昌平线昌平站1050米,111.25
2170.0,9.0,145439-C,3室1卫,1/6层,顺义区,国展,莲竹花园,地铁：距15号线国展站350米,241.11111111111111
2660.0,21.0,145916-C,3室1卫,1/6层,昌平区,回龙观东大街,天龙苑,地铁：距8号线回龙观东大街站650米,126.66666666666667
2950.0,14.0,145763-A,3室1卫,5/6层,海淀区,育新,常秀家园,地铁：距8号线育新站1450米,210.71428571428572
2040.0,11.0,146229-A,2室1卫,6/8层,房山区,稻田,长景新园,地铁：距房山线稻田站350米,185.45454545454547
2240.0,8.0,147307-C,3室1卫,5/28层,朝阳区,垡头,垡头翠城馨园南区,地铁：距7号线垡头站850米,280.0
2450.0,16.0,13643-A,3室1卫,4/6层,朝阳区,常营,连心园西区,地铁：距6号线常营站800米,153.125
2000.0,11.0,155106-C,3室1卫,1/6层,通州区,通州北苑,新仓路27号院,地铁：距八通线通州北苑站1000米,181.8181818181818
5830.0,50.0,155551-A,1室1卫,12/12层,东城区,广渠门内,绿景苑,地铁：距7号线广渠门内站650米,116.6
4730.0,20.0,157219-B,2室1卫,3/16层,海淀区,大钟寺,蓟门东里,"地铁：距12号线,13号线大钟寺站700米",236.5
2610.0,17.0,14949-B,2室1卫,5/5层,朝阳区,常营,管庄东里,地铁：距6号线常营站700米,153.52941176470588
1820.0,10.0,149-C,4室2卫,5/6层,通州区,果园,翠屏北里西区,地铁：距八通线果园站400米,182.0
6290.0,59.0,18471-A,1室1卫,18/24层,朝阳区,高碑店,兴隆家园,地铁：距八通线高碑店站600米,106.61016949152543
3250.0,17.0,22743-C,3室1卫,16/21层,朝阳区,青年路,朝阳无限芳菁苑,地铁：距6号线青年路站750米,191.1764705882353
2580.0,14.0,2408-A,3室1卫,17/26层,朝阳区,常营,北辰福第中区,地铁：距6号线常营站450米,184.28571428571428
2580.0,13.0,2408-B,3室1卫,17/26层,朝阳区,常营,北辰福第中区,地铁：距6号线常营站450米,198.46153846153845
1200.0,11.0,24840-D,5室2卫,2/3层,房山区,阎村,天恒乐活城,地铁：距燕房线阎村站200米,109.0909090909091
2070.0,10.0,22996-A,3室1卫,5/6层,顺义区,花梨坎,三山新新家园,地铁：距15号线花梨坎站2100米,207.0
2030.0,12.0,24391-B,3室1卫,6/6层,通州区,次渠,府东苑,"地铁：距亦庄线,17号线次渠站1150米",169.16666666666666
2940.0,12.0,2592-A,4室1卫,4/6层,东城区,广渠门外,双花园南里,"地铁：距7号线,17号线广渠门外站650米",245.0
1750.0,15.0,26889-A,3室1卫,14/15层,房山区,篱笆房,加州水郡四期,地铁：距房山线篱笆房站2550米,116.66666666666667
2010.0,9.0,35007-B,3室1卫,22/24层,通州区,次渠南,次渠家园东里2区,地铁：距亦庄线次渠南站450米,223.33333333333334
2960.0,20.0,29731-C,4室1卫,6/6层,昌平区,龙泽,金达园,地铁：距13号线龙泽站1250米,148.0
3620.0,21.0,37446-C,4室1卫,5/6层,朝阳区,褡裢坡,美然动力A3区,地铁：距6号线褡裢坡站500米,172.38095238095238
2930.0,14.0,36834-C,3室1卫,3/7层,朝阳区,劲松,劲松二区,地铁：距10号线劲松站600米,209.28571428571428
